<?xml version="1.0"?>
<!-- Alternativa en XML para validar nuestros XMLs   -->
<xsd:schema xmlns:xsd="http://www.w3.org/2001/XMLSchema">

    <xsd:element name="configuracion_servidor">
        <xsd:complexType>
            <xsd:sequence>
            
                <xsd:element name="base_datos" maxOccurs="unbounded">
                    <xsd:complexType>
                        <xsd:sequence>
                            <xsd:element name="usuario" type="xsd:string"></xsd:element>
                            <xsd:element name="contrasena" type="xsd:string"></xsd:element>
                            <xsd:element name="puerto">
                                <xsd:simpleType>
                                    <xsd:restriction base="xsd:int">
                                        <xsd:minInclusive value="1024"></xsd:minInclusive>
                                        <xsd:maxExclusive value="65535"></xsd:maxExclusive>
                                    </xsd:restriction>
                                </xsd:simpleType>
                             </xsd:element>
                             <xsd:element name="maximo_conexion" type="xsd:int"></xsd:element>
                             <xsd:element name="modo_acceso">
                                    <xsd:simpleType>
                                        <xsd:restriction base="xsd:string">
                                            <xsd:enumeration value="local"></xsd:enumeration>
                                            <xsd:enumeration value="remoto"></xsd:enumeration>
                                        </xsd:restriction>
                                    </xsd:simpleType>
                             </xsd:element>
                        </xsd:sequence> 
                        <xsd:attribute name="nombre" type="xsd:string"></xsd:attribute>                            
                     </xsd:complexType>
                </xsd:element>

                <xsd:element name="backups">
                    <xsd:complexType>
                        <xsd:sequence>
                            <xsd:element name="ruta" type="xsd:string"></xsd:element>
                            <xsd:element name="frecuencia" >
                                <xsd:simpleType>
                                    <xsd:restriction base="xsd:string">
                                        <xsd:enumeration value="diaria"></xsd:enumeration>
                                        <xsd:enumeration value="semanal"></xsd:enumeration>
                                        <xsd:enumeration value="mensual"></xsd:enumeration>
                                    </xsd:restriction>
                                </xsd:simpleType>
                            </xsd:element>
                        </xsd:sequence>
                    </xsd:complexType>
                </xsd:element>
                
            </xsd:sequence>
        </xsd:complexType>
    </xsd:element>
</xsd:schema>
